{
  "registry_id": "reg-00c0ffee0001",
  "asr_spec_version": "0.2.0",
  "title": "Example Registry",
  "description": "Fictional two-source registry exercising the ASR object model end to end (.test domains; every id and hash is real).",
  "readme": "Authoritative Source Registry. Source profiles under sources/, one directory per source; resolve objects through this manifest's sections and source index, never by guessing paths. Access claims are verified against stored probe evidence (see rules_note); credentials are referenced by name and never stored in tracked files.",
  "rules_note": "spec/00-overview.md",
  "defaults": {
    "verification_window_days": 90,
    "politeness_delay_ms": 1000,
    "user_agent_contact": "mailto:fixtures@example.test"
  },
  "sections": {
    "sources": "sources/",
    "topics": "topics.json",
    "sources_csv": "sources.csv",
    "index_html": "index.html",
    "credentials_example": "credentials.example.json",
    "fetched": "fetched/"
  },
  "sources": [
    {
      "source_id": "asc-ca327093cdd0",
      "slug": "meadowlark-observatory-data-service",
      "name": "Meadowlark Observatory Data Service",
      "path": "sources/meadowlark-observatory-data-service/",
      "verification_state": "verified"
    },
    {
      "source_id": "asc-3316339d3d95",
      "slug": "orchard-gazette-archive",
      "name": "Orchard Gazette Archive",
      "path": "sources/orchard-gazette-archive/",
      "verification_state": "verified"
    }
  ],
  "counts": {
    "sources": 2,
    "access_methods": 4,
    "endpoints": 1,
    "probes": 4,
    "fetches": 1
  },
  "integrity": {
    "schema_hash": "sha256:478a40a8e0e31c62d0027f6472616dd59b675434db28722eaae87087cd63a398"
  },
  "provenance": {
    "produced_by": {
      "tool": "authority-fixtures",
      "tool_version": "0.2.0",
      "model": null,
      "method": "fixture",
      "person": null
    },
    "created_at": "2026-08-17T12:00:00.000Z",
    "modified_at": null
  },
  "ext": {},
  "notes": ""
}
