{
  "registry_id": "reg-3e245840a8bb",
  "asr_spec_version": "0.4.0",
  "title": "Nonprofit Filings",
  "description": "US nonprofit filings: identity (EIN, exemption status), Form 990 financials, staff and governance counts, and (later) grants made by private foundations. The filed return is the source of record; aggregators are for finding it.",
  "readme": "Authoritative Source Registry. Source profiles under sources/, one directory per source; resolve objects through this manifest's sections and source index, never by guessing paths. Access claims are verified against stored probe evidence (see rules_note); credentials are referenced by name and never stored in tracked files.",
  "rules_note": "spec/00-overview.md",
  "defaults": {
    "verification_window_days": 90,
    "politeness_delay_ms": 1000,
    "user_agent_contact": "mailto:eorwyn@ucdavis.edu"
  },
  "sections": {
    "sources": "sources/",
    "topics": "topics.json",
    "sources_csv": "sources.csv",
    "index_html": "index.html",
    "credentials_example": "credentials.example.json",
    "fetched": "fetched/",
    "facets": "facets.json"
  },
  "sources": [
    {
      "source_id": "asc-1a4b061f086c",
      "slug": "california-registry-of-charitable-trusts",
      "name": "California Registry of Charitable Trusts",
      "path": "sources/california-registry-of-charitable-trusts/",
      "verification_state": "verified"
    },
    {
      "source_id": "asc-595175c50808",
      "slug": "givingtuesday-990-data-lake",
      "name": "GivingTuesday 990 Data Lake",
      "path": "sources/givingtuesday-990-data-lake/",
      "verification_state": "verified"
    },
    {
      "source_id": "asc-e73b7f1f7746",
      "slug": "irs-tax-exempt-organization-search",
      "name": "IRS Tax Exempt Organization Search",
      "path": "sources/irs-tax-exempt-organization-search/",
      "verification_state": "verified"
    },
    {
      "source_id": "asc-4a846ff1752f",
      "slug": "propublica-nonprofit-explorer",
      "name": "ProPublica Nonprofit Explorer",
      "path": "sources/propublica-nonprofit-explorer/",
      "verification_state": "verified"
    }
  ],
  "counts": {
    "sources": 4,
    "access_methods": 6,
    "endpoints": 3,
    "probes": 6,
    "fetches": 0
  },
  "integrity": {
    "schema_hash": "sha256:d28d58ea66b9d8294d1d4bd57f0c966b5ee18bdf3c945c4c59d4ec19fc01c6b7"
  },
  "provenance": {
    "produced_by": {
      "tool": "authority",
      "tool_version": "0.4.0",
      "model": null,
      "method": "tool",
      "person": null
    },
    "created_at": "2026-09-30T00:22:00.213Z",
    "modified_at": null
  },
  "ext": {},
  "notes": ""
}
