{
  "registry_id": "reg-ef568f3c30d0",
  "asr_spec_version": "0.4.0",
  "title": "Orchestras",
  "description": "Orchestras' own websites: the primary source for each orchestra's seasons, programs, artists, and self-description. One source per orchestra. Started with Berkeley Symphony; peer orchestras are added when the peer-seasons work starts.",
  "readme": "Authoritative Source Registry. Source profiles under sources/, one directory per source; resolve objects through this manifest's sections and source index, never by guessing paths. Access claims are verified against stored probe evidence (see rules_note); credentials are referenced by name and never stored in tracked files.",
  "rules_note": "spec/00-overview.md",
  "defaults": {
    "verification_window_days": 90,
    "politeness_delay_ms": 1000,
    "user_agent_contact": "mailto:eorwyn@ucdavis.edu"
  },
  "sections": {
    "sources": "sources/",
    "topics": "topics.json",
    "sources_csv": "sources.csv",
    "index_html": "index.html",
    "credentials_example": "credentials.example.json",
    "fetched": "fetched/"
  },
  "sources": [
    {
      "source_id": "asc-0e88070e0a77",
      "slug": "berkeley-symphony",
      "name": "Berkeley Symphony",
      "path": "sources/berkeley-symphony/",
      "verification_state": "verified"
    }
  ],
  "counts": {
    "sources": 1,
    "access_methods": 1,
    "endpoints": 6,
    "probes": 1,
    "fetches": 0
  },
  "integrity": {
    "schema_hash": "sha256:d28d58ea66b9d8294d1d4bd57f0c966b5ee18bdf3c945c4c59d4ec19fc01c6b7"
  },
  "provenance": {
    "produced_by": {
      "tool": "authority",
      "tool_version": "0.4.0",
      "model": null,
      "method": "tool",
      "person": null
    },
    "created_at": "2026-09-30T00:22:00.128Z",
    "modified_at": null
  },
  "ext": {},
  "notes": ""
}
