{
  "registry_id": "reg-1db286e2fa94",
  "asr_spec_version": "0.3.0",
  "title": "Scholarly Literature",
  "description": "Where and how academic literature may be discovered and honestly fetched, for the Hermes deep-research skill (pilot: residential electrification — heat pumps, HPWHs, induction, and electrical panel/service capacity).",
  "readme": "Authoritative Source Registry. Source profiles under sources/, one directory per source; resolve objects through this manifest's sections and source index, never by guessing paths. Access claims are verified against stored probe evidence (see rules_note); credentials are referenced by name and never stored in tracked files.",
  "rules_note": "spec/00-overview.md",
  "defaults": {
    "verification_window_days": 90,
    "politeness_delay_ms": 1000,
    "user_agent_contact": "mailto:eorwyn@ucdavis.edu"
  },
  "sections": {
    "sources": "sources/",
    "topics": "topics.json",
    "sources_csv": "sources.csv",
    "index_html": "index.html",
    "credentials_example": "credentials.example.json",
    "fetched": "fetched/",
    "facets": "facets.json"
  },
  "sources": [
    {
      "source_id": "asc-33ee865a7e80",
      "slug": "crossref",
      "name": "Crossref",
      "path": "sources/crossref/",
      "verification_state": "verified"
    },
    {
      "source_id": "asc-1957a4f7bc82",
      "slug": "openalex",
      "name": "OpenAlex",
      "path": "sources/openalex/",
      "verification_state": "verified"
    },
    {
      "source_id": "asc-9fa5a9529521",
      "slug": "sciencedirect",
      "name": "ScienceDirect",
      "path": "sources/sciencedirect/",
      "verification_state": "blocked"
    },
    {
      "source_id": "asc-5c57285fc052",
      "slug": "uc-davis-library",
      "name": "UC Davis Library",
      "path": "sources/uc-davis-library/",
      "verification_state": "asserted"
    },
    {
      "source_id": "asc-51f30bd0a93f",
      "slug": "unpaywall",
      "name": "Unpaywall",
      "path": "sources/unpaywall/",
      "verification_state": "verified"
    }
  ],
  "counts": {
    "sources": 5,
    "access_methods": 6,
    "endpoints": 8,
    "probes": 8,
    "fetches": 26
  },
  "integrity": {
    "schema_hash": "sha256:de400063387a5fc0ac98af53e78f2d898efd8ac880591beebea9df107e664f4a"
  },
  "provenance": {
    "produced_by": {
      "tool": "authority",
      "tool_version": "0.3.0",
      "model": null,
      "method": "tool",
      "person": null
    },
    "created_at": "2026-09-27T00:45:20.753Z",
    "modified_at": null
  },
  "ext": {},
  "notes": ""
}
